question_id,question_data,subquestions,text,data
AvaliaSetores,A organização e a gestão dos seguintes setores da UFJF são satisfatórias.,AvaliaSetores[COORD],Coordenação de curso de graduação ou de programa de pós-graduação,"['1-Concordo totalmente', '3-Não concordo nem discordo', '3-Não concordo nem discordo', '6-Não sei / Não se aplica', '1-Concordo totalmente', '5-Discordo totalmente', '2-Concordo', '4-Discordo', '6-Não sei / Não se aplica', '2-Concordo', '2-Concordo', '2-Concordo', '6-Não sei / Não se aplica', '4-Discordo', '2-Concordo', '2-Concordo', '1-Concordo totalmente', '4-Discordo', '2-Concordo', '2-Concordo', '5-Discordo totalmente', '2-Concordo', '3-Não concordo nem discordo', '1-Concordo totalmente', '1-Concordo totalmente', '1-Concordo totalmente', '2-Concordo', '3-Não concordo nem discordo', '2-Concordo', '1-Concordo totalmente', '3-Não concordo nem discordo', '1-Concordo totalmente', '4-Discordo', '2-Concordo', '3-Não concordo nem discordo', '2-Concordo', '4-Discordo', '4-Discordo', '6-Não sei / Não se aplica', '1-Concordo totalmente', '1-Concordo totalmente', '2-Concordo', '2-Concordo', '1-Concordo totalmente', '4-Discordo', '5-Discordo totalmente', '3-Não concordo nem discordo', '2-Concordo', '1-Concordo totalmente', '2-Concordo', '2-Concordo', '2-Concordo', '1-Concordo totalmente', '1-Concordo totalmente', '2-Concordo', '3-Não concordo nem discordo', '1-Concordo totalmente', '3-Não concordo nem discordo', '2-Concordo', '1-Concordo totalmente', '1-Concordo totalmente', '6-Não sei / Não se aplica', '1-Concordo totalmente', '1-Concordo totalmente', '2-Concordo', '3-Não concordo nem discordo', '3-Não concordo nem discordo', '2-Concordo', '4-Discordo', '2-Concordo', '4-Discordo', '6-Não sei / Não se aplica', '1-Concordo totalmente', '2-Concordo', '3-Não concordo nem discordo', '1-Concordo totalmente', '2-Concordo', '4-Discordo', '1-Concordo totalmente', '1-Concordo totalmente', '2-Concordo', '1-Concordo totalmente', '2-Concordo', '2-Concordo', '1-Concordo totalmente', '4-Discordo', '2-Concordo', '1-Concordo totalmente', '6-Não sei / Não se aplica', '3-Não concordo nem discordo', '4-Discordo', '5-Discordo totalmente', '5-Discordo totalmente', '6-Não sei / Não se aplica', '4-Discordo', '1-Concordo totalmente', '2-Concordo', '6-Não sei / Não se aplica', '2-Concordo', '2-Concordo', '2-Concordo', '6-Não sei / Não se aplica', '1-Concordo totalmente', '1-Concordo totalmente', '1-Concordo totalmente', '6-Não sei / Não se aplica', '3-Não concordo nem discordo', '2-Concordo', '3-Não concordo nem discordo', '6-Não sei / Não se aplica', '5-Discordo totalmente', '1-Concordo totalmente', '4-Discordo', '1-Concordo totalmente', '4-Discordo', '3-Não concordo nem discordo', '2-Concordo', '2-Concordo', '1-Concordo totalmente', '2-Concordo', '2-Concordo', '5-Discordo totalmente', '2-Concordo', '3-Não concordo nem discordo', '4-Discordo']"
AvaliaSetores,A organização e a gestão dos seguintes setores da UFJF são satisfatórias.,AvaliaSetores[OUVID],Ouvidoria,"['2-Concordo', '4-Discordo', '3-Não concordo nem discordo', '6-Não sei / Não se aplica', '6-Não sei / Não se aplica', '4-Discordo', '1-Concordo totalmente', '4-Discordo', '6-Não sei / Não se aplica', '2-Concordo', '2-Concordo', '2-Concordo', '6-Não sei / Não se aplica', '1-Concordo totalmente', '6-Não sei / Não se aplica', '4-Discordo', '2-Concordo', '3-Não concordo nem discordo', '3-Não concordo nem discordo', '6-Não sei / Não se aplica', '5-Discordo totalmente', '2-Concordo', '3-Não concordo nem discordo', '6-Não sei / Não se aplica', '2-Concordo', '1-Concordo totalmente', '6-Não sei / Não se aplica', '3-Não concordo nem discordo', '2-Concordo', '1-Concordo totalmente', '2-Concordo', '6-Não sei / Não se aplica', '4-Discordo', '2-Concordo', '3-Não concordo nem discordo', '2-Concordo', '6-Não sei / Não se aplica', '4-Discordo', '6-Não sei / Não se aplica', '2-Concordo', '1-Concordo totalmente', '1-Concordo totalmente', '2-Concordo', '1-Concordo totalmente', '6-Não sei / Não se aplica', '6-Não sei / Não se aplica', '3-Não concordo nem discordo', '2-Concordo', '6-Não sei / Não se aplica', '6-Não sei / Não se aplica', '1-Concordo totalmente', '2-Concordo', '6-Não sei / Não se aplica', '1-Concordo totalmente', '2-Concordo', '2-Concordo', '2-Concordo', '3-Não concordo nem discordo', '6-Não sei / Não se aplica', '2-Concordo', '1-Concordo totalmente', '6-Não sei / Não se aplica', '1-Concordo totalmente', '1-Concordo totalmente', '3-Não concordo nem discordo', '3-Não concordo nem discordo', '2-Concordo', '2-Concordo', '4-Discordo', '6-Não sei / Não se aplica', '2-Concordo', '6-Não sei / Não se aplica', '6-Não sei / Não se aplica', '3-Não concordo nem discordo', '3-Não concordo nem discordo', '1-Concordo totalmente', '2-Concordo', '4-Discordo', '1-Concordo totalmente', '3-Não concordo nem discordo', '2-Concordo', '3-Não concordo nem discordo', '3-Não concordo nem discordo', '4-Discordo', '1-Concordo totalmente', '6-Não sei / Não se aplica', '2-Concordo', '3-Não concordo nem discordo', '4-Discordo', '3-Não concordo nem discordo', '5-Discordo totalmente', '3-Não concordo nem discordo', '1-Concordo totalmente', '6-Não sei / Não se aplica', '6-Não sei / Não se aplica', '6-Não sei / Não se aplica', '2-Concordo', '2-Concordo', '3-Não concordo nem discordo', '6-Não sei / Não se aplica', '3-Não concordo nem discordo', '6-Não sei / Não se aplica', '1-Concordo totalmente', '4-Discordo', '1-Concordo totalmente', '6-Não sei / Não se aplica', '6-Não sei / Não se aplica', '2-Concordo', '3-Não concordo nem discordo', '1-Concordo totalmente', '1-Concordo totalmente', '2-Concordo', '6-Não sei / Não se aplica', '2-Concordo', '1-Concordo totalmente', '5-Discordo totalmente', '2-Concordo', '6-Não sei / Não se aplica', '1-Concordo totalmente', '6-Não sei / Não se aplica', '3-Não concordo nem discordo', '5-Discordo totalmente', '2-Concordo', '3-Não concordo nem discordo', '2-Concordo']"
AvaliaSetores,A organização e a gestão dos seguintes setores da UFJF são satisfatórias.,AvaliaSetores[CATEND],Central de Atendimento,"['4-Discordo', '4-Discordo', '2-Concordo', '6-Não sei / Não se aplica', '2-Concordo', '4-Discordo', '2-Concordo', '2-Concordo', '6-Não sei / Não se aplica', '2-Concordo', '2-Concordo', '2-Concordo', '3-Não concordo nem discordo', '6-Não sei / Não se aplica', '2-Concordo', '2-Concordo', '2-Concordo', '3-Não concordo nem discordo', '2-Concordo', '6-Não sei / Não se aplica', '5-Discordo totalmente', '2-Concordo', '3-Não concordo nem discordo', '6-Não sei / Não se aplica', '1-Concordo totalmente', '1-Concordo totalmente', '1-Concordo totalmente', '3-Não concordo nem discordo', '2-Concordo', '1-Concordo totalmente', '2-Concordo', '1-Concordo totalmente', '4-Discordo', '2-Concordo', '3-Não concordo nem discordo', '2-Concordo', '6-Não sei / Não se aplica', '4-Discordo', '1-Concordo totalmente', '3-Não concordo nem discordo', '1-Concordo totalmente', '1-Concordo totalmente', '2-Concordo', '1-Concordo totalmente', '6-Não sei / Não se aplica', '2-Concordo', '3-Não concordo nem discordo', '1-Concordo totalmente', '3-Não concordo nem discordo', '6-Não sei / Não se aplica', '1-Concordo totalmente', '2-Concordo', '2-Concordo', '1-Concordo totalmente', '2-Concordo', '2-Concordo', '2-Concordo', '3-Não concordo nem discordo', '2-Concordo', '2-Concordo', '1-Concordo totalmente', '6-Não sei / Não se aplica', '1-Concordo totalmente', '1-Concordo totalmente', '3-Não concordo nem discordo', '3-Não concordo nem discordo', '2-Concordo', '2-Concordo', '3-Não concordo nem discordo', '6-Não sei / Não se aplica', '2-Concordo', '3-Não concordo nem discordo', '1-Concordo totalmente', '4-Discordo', '3-Não concordo nem discordo', '1-Concordo totalmente', '1-Concordo totalmente', '4-Discordo', '1-Concordo totalmente', '4-Discordo', '2-Concordo', '3-Não concordo nem discordo', '2-Concordo', '3-Não concordo nem discordo', '1-Concordo totalmente', '6-Não sei / Não se aplica', '2-Concordo', '1-Concordo totalmente', '4-Discordo', '4-Discordo', '6-Não sei / Não se aplica', '3-Não concordo nem discordo', '1-Concordo totalmente', '6-Não sei / Não se aplica', '1-Concordo totalmente', '6-Não sei / Não se aplica', '2-Concordo', '1-Concordo totalmente', '6-Não sei / Não se aplica', '1-Concordo totalmente', '2-Concordo', '2-Concordo', '1-Concordo totalmente', '5-Discordo totalmente', '1-Concordo totalmente', '6-Não sei / Não se aplica', '6-Não sei / Não se aplica', '1-Concordo totalmente', '3-Não concordo nem discordo', '2-Concordo', '1-Concordo totalmente', '2-Concordo', '6-Não sei / Não se aplica', '6-Não sei / Não se aplica', '1-Concordo totalmente', '5-Discordo totalmente', '2-Concordo', '6-Não sei / Não se aplica', '1-Concordo totalmente', '6-Não sei / Não se aplica', '3-Não concordo nem discordo', '5-Discordo totalmente', '2-Concordo', '2-Concordo', '2-Concordo']"
EstReg,Considero que o Estatuto e o Regimento Geral da UFJF regulamentam o funcionamento da Instituição de forma apropriada.,EstReg,Considero que o Estatuto e o Regimento Geral da UFJF regulamentam o funcionamento da Instituição de forma apropriada.,"['4-Discordo', '2-Concordo', '2-Concordo', '2-Concordo', '1-Concordo totalmente', '4-Discordo', '4-Discordo', '3-Não concordo nem discordo', '1-Concordo totalmente', '3-Não concordo nem discordo', '4-Discordo', '2-Concordo', '2-Concordo', '4-Discordo', '1-Concordo totalmente', '2-Concordo', '4-Discordo', '2-Concordo', '2-Concordo', '2-Concordo', '3-Não concordo nem discordo', '4-Discordo', '2-Concordo', '3-Não concordo nem discordo', '1-Concordo totalmente', '2-Concordo', '2-Concordo', '2-Concordo', '4-Discordo', '1-Concordo totalmente', '4-Discordo', '1-Concordo totalmente', '4-Discordo', '2-Concordo', '2-Concordo', '2-Concordo', '5-Discordo totalmente', '6-Não sei / Não se aplica', '1-Concordo totalmente', '2-Concordo', '1-Concordo totalmente', '1-Concordo totalmente', '3-Não concordo nem discordo', '1-Concordo totalmente', '2-Concordo', '4-Discordo', '3-Não concordo nem discordo', '1-Concordo totalmente', '3-Não concordo nem discordo', '3-Não concordo nem discordo', '1-Concordo totalmente', '2-Concordo', '6-Não sei / Não se aplica', '1-Concordo totalmente', '2-Concordo', '4-Discordo', '2-Concordo', '3-Não concordo nem discordo', '2-Concordo', '2-Concordo', '1-Concordo totalmente', '3-Não concordo nem discordo', '1-Concordo totalmente', '1-Concordo totalmente', '2-Concordo', '1-Concordo totalmente', '2-Concordo', '4-Discordo', '3-Não concordo nem discordo', '2-Concordo', '2-Concordo', '3-Não concordo nem discordo', '6-Não sei / Não se aplica', '2-Concordo', '3-Não concordo nem discordo', '4-Discordo', '3-Não concordo nem discordo', '4-Discordo', '1-Concordo totalmente', '4-Discordo', '2-Concordo', '2-Concordo', '1-Concordo totalmente', '3-Não concordo nem discordo', '1-Concordo totalmente', '2-Concordo', '5-Discordo totalmente', '2-Concordo', '4-Discordo', '2-Concordo', '2-Concordo', '2-Concordo', '2-Concordo', '2-Concordo', '4-Discordo', '6-Não sei / Não se aplica', '2-Concordo', '6-Não sei / Não se aplica', '2-Concordo', '1-Concordo totalmente', '3-Não concordo nem discordo', '2-Concordo', '1-Concordo totalmente', '5-Discordo totalmente', '4-Discordo', '2-Concordo', '2-Concordo', '4-Discordo', '3-Não concordo nem discordo', '2-Concordo', '2-Concordo', '1-Concordo totalmente', '4-Discordo', '5-Discordo totalmente', '4-Discordo', '2-Concordo', '2-Concordo', '2-Concordo', '1-Concordo totalmente', '2-Concordo', '2-Concordo', '3-Não concordo nem discordo', '3-Não concordo nem discordo', '4-Discordo', '5-Discordo totalmente']"
RAGRI,"Conheço o teor do Regulamento Acadêmico da Graduação (RAG) - ou, no caso de estudante da pós-graduação, o Regimento Geral do Programa no qual estou matriculado - e o considero adequado.",RAGRI,"Conheço o teor do Regulamento Acadêmico da Graduação (RAG) - ou, no caso de estudante da pós-graduação, o Regimento Geral do Programa no qual estou matriculado - e o considero adequado.","['4-Discordo', '2-Concordo', '1-Concordo totalmente', '2-Concordo', '1-Concordo totalmente', '4-Discordo', '2-Concordo', '2-Concordo', '1-Concordo totalmente', '3-Não concordo nem discordo', '2-Concordo', '2-Concordo', '4-Discordo', '1-Concordo totalmente', '1-Concordo totalmente', '2-Concordo', '3-Não concordo nem discordo', '2-Concordo', '4-Discordo', '1-Concordo totalmente', '2-Concordo', '1-Concordo totalmente', '4-Discordo', '2-Concordo', '1-Concordo totalmente', '3-Não concordo nem discordo', '2-Concordo', '2-Concordo', '3-Não concordo nem discordo', '1-Concordo totalmente', '2-Concordo', '1-Concordo totalmente', '2-Concordo', '6-Não sei / Não se aplica', '2-Concordo', '2-Concordo', '5-Discordo totalmente', '3-Não concordo nem discordo', '2-Concordo', '2-Concordo', '1-Concordo totalmente', '2-Concordo', '3-Não concordo nem discordo', '1-Concordo totalmente', '1-Concordo totalmente', '3-Não concordo nem discordo', '3-Não concordo nem discordo', '1-Concordo totalmente', '2-Concordo', '1-Concordo totalmente', '1-Concordo totalmente', '2-Concordo', '2-Concordo', '1-Concordo totalmente', '2-Concordo', '1-Concordo totalmente', '2-Concordo', '2-Concordo', '1-Concordo totalmente', '1-Concordo totalmente', '2-Concordo', '1-Concordo totalmente', '1-Concordo totalmente', '1-Concordo totalmente', '1-Concordo totalmente', '1-Concordo totalmente', '2-Concordo', '2-Concordo', '6-Não sei / Não se aplica', '2-Concordo', '2-Concordo', '1-Concordo totalmente', '1-Concordo totalmente', '2-Concordo', '4-Discordo', '1-Concordo totalmente', '3-Não concordo nem discordo', '2-Concordo', '1-Concordo totalmente', '5-Discordo totalmente', '2-Concordo', '2-Concordo', '2-Concordo', '3-Não concordo nem discordo', '1-Concordo totalmente', '2-Concordo', '2-Concordo', '1-Concordo totalmente', '2-Concordo', '2-Concordo', '2-Concordo', '2-Concordo', '3-Não concordo nem discordo', '4-Discordo', '1-Concordo totalmente', '6-Não sei / Não se aplica', '2-Concordo', '1-Concordo totalmente', '2-Concordo', '1-Concordo totalmente', '2-Concordo', '2-Concordo', '1-Concordo totalmente', '4-Discordo', '4-Discordo', '2-Concordo', '2-Concordo', '2-Concordo', '3-Não concordo nem discordo', '2-Concordo', '2-Concordo', '2-Concordo', '4-Discordo', '1-Concordo totalmente', '2-Concordo', '4-Discordo', '2-Concordo', '4-Discordo', '1-Concordo totalmente', '1-Concordo totalmente', '2-Concordo', '3-Não concordo nem discordo', '2-Concordo', '3-Não concordo nem discordo', '5-Discordo totalmente']"
CPA,"Tenho conhecimento das atividades desenvolvidas pela Comissão Própria de Avaliação (CPA) - no caso de servidor(a) do campus avançado de GV, da Comissão Setorial Própria de Avaliação (CSPA).",CPA,"Tenho conhecimento das atividades desenvolvidas pela Comissão Própria de Avaliação (CPA) - no caso de servidor(a) do campus avançado de GV, da Comissão Setorial Própria de Avaliação (CSPA).","['3-Não concordo nem discordo', '5-Discordo totalmente', '5-Discordo totalmente', '4-Discordo', '3-Não concordo nem discordo', '3-Não concordo nem discordo', '4-Discordo', '3-Não concordo nem discordo', '3-Não concordo nem discordo', '5-Discordo totalmente', '3-Não concordo nem discordo', '2-Concordo', '5-Discordo totalmente', '5-Discordo totalmente', '3-Não concordo nem discordo', '4-Discordo', '3-Não concordo nem discordo', '3-Não concordo nem discordo', '5-Discordo totalmente', '4-Discordo', '3-Não concordo nem discordo', '4-Discordo', '5-Discordo totalmente', '3-Não concordo nem discordo', '2-Concordo', '4-Discordo', '2-Concordo', '5-Discordo totalmente', '5-Discordo totalmente', '3-Não concordo nem discordo', '3-Não concordo nem discordo', '2-Concordo', '5-Discordo totalmente', '3-Não concordo nem discordo', '4-Discordo', '3-Não concordo nem discordo', '4-Discordo', '3-Não concordo nem discordo', '5-Discordo totalmente', '3-Não concordo nem discordo', '1-Concordo totalmente', '4-Discordo', '4-Discordo', '1-Concordo totalmente', '5-Discordo totalmente', '4-Discordo', '2-Concordo', '2-Concordo', '3-Não concordo nem discordo', '5-Discordo totalmente', '2-Concordo', '2-Concordo', '5-Discordo totalmente', '2-Concordo', '2-Concordo', '5-Discordo totalmente', '3-Não concordo nem discordo', '4-Discordo', '5-Discordo totalmente', '2-Concordo', '1-Concordo totalmente', '4-Discordo', '2-Concordo', '2-Concordo', '3-Não concordo nem discordo', '5-Discordo totalmente', '3-Não concordo nem discordo', '3-Não concordo nem discordo', '3-Não concordo nem discordo', '4-Discordo', '4-Discordo', '3-Não concordo nem discordo', '5-Discordo totalmente', '4-Discordo', '3-Não concordo nem discordo', '5-Discordo totalmente', '5-Discordo totalmente', '5-Discordo totalmente', '4-Discordo', '4-Discordo', '2-Concordo', '2-Concordo', '5-Discordo totalmente', '3-Não concordo nem discordo', '1-Concordo totalmente', '4-Discordo', '5-Discordo totalmente', '5-Discordo totalmente', '2-Concordo', '3-Não concordo nem discordo', '4-Discordo', '3-Não concordo nem discordo', '5-Discordo totalmente', '3-Não concordo nem discordo', '2-Concordo', '1-Concordo totalmente', '2-Concordo', '1-Concordo totalmente', '5-Discordo totalmente', '2-Concordo', '3-Não concordo nem discordo', '3-Não concordo nem discordo', '2-Concordo', '5-Discordo totalmente', '3-Não concordo nem discordo', '5-Discordo totalmente', '4-Discordo', '4-Discordo', '3-Não concordo nem discordo', '3-Não concordo nem discordo', '4-Discordo', '2-Concordo', '5-Discordo totalmente', '3-Não concordo nem discordo', '5-Discordo totalmente', '3-Não concordo nem discordo', '2-Concordo', '4-Discordo', '5-Discordo totalmente', '3-Não concordo nem discordo', '3-Não concordo nem discordo', '3-Não concordo nem discordo', '2-Concordo', '3-Não concordo nem discordo', '1-Concordo totalmente']"
AplRF,A aplicação dos recursos financeiros da UFJF é satisfatória quanto à (ao):,AplRF[DAtEn],Desenvolvimento das atividades de ensino.,"['3-Não concordo nem discordo', '2-Concordo', '5-Discordo totalmente', '6-Não sei / Não se aplica', '2-Concordo', '3-Não concordo nem discordo', '2-Concordo', '2-Concordo', '4-Discordo', '3-Não concordo nem discordo', '3-Não concordo nem discordo', '2-Concordo', '2-Concordo', '4-Discordo', '1-Concordo totalmente', '4-Discordo', '4-Discordo', '4-Discordo', '4-Discordo', '2-Concordo', '1-Concordo totalmente', '3-Não concordo nem discordo', '3-Não concordo nem discordo', '1-Concordo totalmente', '3-Não concordo nem discordo', '1-Concordo totalmente', '1-Concordo totalmente', '3-Não concordo nem discordo', '5-Discordo totalmente', '1-Concordo totalmente', '2-Concordo', '2-Concordo', '3-Não concordo nem discordo', '2-Concordo', '2-Concordo', '2-Concordo', '6-Não sei / Não se aplica', '2-Concordo', '3-Não concordo nem discordo', '2-Concordo', '1-Concordo totalmente', '1-Concordo totalmente', '3-Não concordo nem discordo', '1-Concordo totalmente', '6-Não sei / Não se aplica', '6-Não sei / Não se aplica', '2-Concordo', '2-Concordo', '2-Concordo', '6-Não sei / Não se aplica', '1-Concordo totalmente', '2-Concordo', '2-Concordo', '2-Concordo', '2-Concordo', '4-Discordo', '2-Concordo', '3-Não concordo nem discordo', '3-Não concordo nem discordo', '1-Concordo totalmente', '1-Concordo totalmente', '4-Discordo', '4-Discordo', '1-Concordo totalmente', '2-Concordo', '3-Não concordo nem discordo', '6-Não sei / Não se aplica', '3-Não concordo nem discordo', '4-Discordo', '2-Concordo', '2-Concordo', '3-Não concordo nem discordo', '1-Concordo totalmente', '2-Concordo', '2-Concordo', '1-Concordo totalmente', '6-Não sei / Não se aplica', '4-Discordo', '1-Concordo totalmente', '4-Discordo', '2-Concordo', '1-Concordo totalmente', '6-Não sei / Não se aplica', '3-Não concordo nem discordo', '1-Concordo totalmente', '3-Não concordo nem discordo', '5-Discordo totalmente', '1-Concordo totalmente', '4-Discordo', '3-Não concordo nem discordo', '5-Discordo totalmente', '4-Discordo', '2-Concordo', '3-Não concordo nem discordo', '2-Concordo', '1-Concordo totalmente', '2-Concordo', '3-Não concordo nem discordo', '4-Discordo', '1-Concordo totalmente', '3-Não concordo nem discordo', '6-Não sei / Não se aplica', '2-Concordo', '5-Discordo totalmente', '4-Discordo', '5-Discordo totalmente', '2-Concordo', '2-Concordo', '4-Discordo', '2-Concordo', '3-Não concordo nem discordo', '1-Concordo totalmente', '5-Discordo totalmente', '1-Concordo totalmente', '1-Concordo totalmente', '4-Discordo', '2-Concordo', '4-Discordo', '3-Não concordo nem discordo', '2-Concordo', '1-Concordo totalmente', '2-Concordo', '2-Concordo', '1-Concordo totalmente', '2-Concordo']"
AplRF,A aplicação dos recursos financeiros da UFJF é satisfatória quanto à (ao):,AplRF[DAtPe],Desenvolvimento das atividades de pesquisa.,"['4-Discordo', '2-Concordo', '2-Concordo', '6-Não sei / Não se aplica', '1-Concordo totalmente', '2-Concordo', '2-Concordo', '4-Discordo', '4-Discordo', '3-Não concordo nem discordo', '3-Não concordo nem discordo', '2-Concordo', '5-Discordo totalmente', '4-Discordo', '2-Concordo', '4-Discordo', '4-Discordo', '4-Discordo', '3-Não concordo nem discordo', '3-Não concordo nem discordo', '1-Concordo totalmente', '3-Não concordo nem discordo', '3-Não concordo nem discordo', '4-Discordo', '3-Não concordo nem discordo', '1-Concordo totalmente', '1-Concordo totalmente', '3-Não concordo nem discordo', '5-Discordo totalmente', '1-Concordo totalmente', '2-Concordo', '3-Não concordo nem discordo', '2-Concordo', '2-Concordo', '2-Concordo', '3-Não concordo nem discordo', '6-Não sei / Não se aplica', '2-Concordo', '4-Discordo', '4-Discordo', '1-Concordo totalmente', '1-Concordo totalmente', '2-Concordo', '1-Concordo totalmente', '6-Não sei / Não se aplica', '6-Não sei / Não se aplica', '4-Discordo', '2-Concordo', '2-Concordo', '2-Concordo', '1-Concordo totalmente', '2-Concordo', '4-Discordo', '5-Discordo totalmente', '2-Concordo', '4-Discordo', '2-Concordo', '3-Não concordo nem discordo', '3-Não concordo nem discordo', '2-Concordo', '1-Concordo totalmente', '4-Discordo', '4-Discordo', '1-Concordo totalmente', '4-Discordo', '3-Não concordo nem discordo', '2-Concordo', '3-Não concordo nem discordo', '5-Discordo totalmente', '2-Concordo', '2-Concordo', '3-Não concordo nem discordo', '1-Concordo totalmente', '2-Concordo', '2-Concordo', '1-Concordo totalmente', '6-Não sei / Não se aplica', '5-Discordo totalmente', '1-Concordo totalmente', '4-Discordo', '2-Concordo', '1-Concordo totalmente', '2-Concordo', '3-Não concordo nem discordo', '1-Concordo totalmente', '2-Concordo', '5-Discordo totalmente', '2-Concordo', '2-Concordo', '3-Não concordo nem discordo', '5-Discordo totalmente', '2-Concordo', '3-Não concordo nem discordo', '2-Concordo', '2-Concordo', '1-Concordo totalmente', '2-Concordo', '3-Não concordo nem discordo', '4-Discordo', '1-Concordo totalmente', '3-Não concordo nem discordo', '6-Não sei / Não se aplica', '1-Concordo totalmente', '5-Discordo totalmente', '4-Discordo', '5-Discordo totalmente', '1-Concordo totalmente', '2-Concordo', '6-Não sei / Não se aplica', '2-Concordo', '1-Concordo totalmente', '2-Concordo', '5-Discordo totalmente', '1-Concordo totalmente', '4-Discordo', '2-Concordo', '2-Concordo', '6-Não sei / Não se aplica', '1-Concordo totalmente', '2-Concordo', '2-Concordo', '2-Concordo', '3-Não concordo nem discordo', '1-Concordo totalmente', '2-Concordo']"
